### ISSUE TITLE
mcrypt bindings being used when openssl engine is expected

### ISSUE THREAD

**Issue by cgkkevinr** [phpseclib/phpseclib#1276]
Hello,

I'm using phpseclib 2.0.11.

I've been troubleshooting deprecation errors coming from SSH2 for `mcrypt_generic` and `mdecrypt_generic`. From what I understand phpseclib should be suppressing these, but I'm still seeing these on the 2.0.11 release when wrapping calls to `read`, `write`, etc. in my own error handler. This is probably an issue on my end, so that aside for a moment.

I'm having difficulty understanding why phpseclib is using the mcrypt bindings to begin with, from what I can tell it should be using the openssl bindings.

Here's the exchange:

```
13:55:27.929740 00:50:56:b6:12:47 > 00:09:0f:09:00:24, ethertype IPv4 (0x0800), length 107: (tos 0x0, ttl 64, id 35190, offset 0, flags [DF], proto TCP (6), length 93)
    192.0.2.10.59836 > 198.51.100.10.22: Flags [P.], cksum 0x0783 (incorrect -> 0xad64), seq 1076463147:1076463188, ack 2001712757, win 229, options [nop,nop,TS val 1791037279 ecr 3359837565], length 41
        0x0000:  4500 005d 8976 4000 4006 a9f1 c001 010a  E..].v@.@.......
        0x0010:  0a1e 3c0a e9bc 0016 4029 862b 774f b675  ..<.....@).+wO.u
        0x0020:  8018 00e5 0783 0000 0101 080a 6ac1 0f5f  ............j.._
        0x0030:  c843 0d7d 5353 482d 322e 302d 7068 7073  .C.}SSH-2.0-phps
        0x0040:  6563 6c69 625f 322e 3020 286f 7065 6e73  eclib_2.0.(opens
        0x0050:  736c 2c20 6263 6d61 7468 290d 0a         sl,.bcmath)..
13:55:27.932466 00:09:0f:09:00:24 > 00:50:56:b6:12:47, ethertype IPv4 (0x0800), length 66: (tos 0x0, ttl 61, id 41547, offset 0, flags [none], proto TCP (6), length 52)
    198.51.100.10.22 > 192.0.2.10.59836: Flags [.], cksum 0x413c (correct), seq 2001712757, ack 1076463188, win 87, options [nop,nop,TS val 3359837565 ecr 1791037279], length 0
        0x0000:  4500 0034 a24b 0000 3d06 d445 0a1e 3c0a  E..4.K..=..E..<.
        0x0010:  c001 010a 0016 e9bc 774f b675 4029 8654  ........wO.u@).T
        0x0020:  8010 0057 413c 0000 0101 080a c843 0d7d  ...WA<.......C.}
        0x0030:  6ac1 0f5f                                j.._
13:55:32.950907 00:09:0f:09:00:24 > 00:50:56:b6:12:47, ethertype IPv4 (0x0800), length 84: (tos 0x0, ttl 61, id 41548, offset 0, flags [none], proto TCP (6), length 70)
    198.51.100.10.22 > 192.0.2.10.59836: Flags [P.], cksum 0xbe1c (correct), seq 2001712757:2001712775, ack 1076463188, win 87, options [nop,nop,TS val 3359838820 ecr 1791037279], length 18
        0x0000:  4500 0046 a24c 0000 3d06 d432 0a1e 3c0a  E..F.L..=..2..<.
        0x0010:  c001 010a 0016 e9bc 774f b675 4029 8654  ........wO.u@).T
        0x0020:  8018 0057 be1c 0000 0101 080a c843 1264  ...W.........C.d
        0x0030:  6ac1 0f5f 5353 482d 322e 302d 4349 5343  j.._SSH-2.0-CISC
        0x0040:  4f5f 574c 430a                           O_WLC.
13:55:32.950941 00:50:56:b6:12:47 > 00:09:0f:09:00:24, ethertype IPv4 (0x0800), length 66: (tos 0x0, ttl 64, id 35191, offset 0, flags [DF], proto TCP (6), length 52)
    192.0.2.10.59836 > 198.51.100.10.22: Flags [.], cksum 0x075a (incorrect -> 0x36ce), seq 1076463188, ack 2001712775, win 229, options [nop,nop,TS val 1791038534 ecr 3359838820], length 0
        0x0000:  4500 0034 8977 4000 4006 aa19 c001 010a  E..4.w@.@.......
        0x0010:  0a1e 3c0a e9bc 0016 4029 8654 774f b687  ..<.....@).TwO..
        0x0020:  8010 00e5 075a 0000 0101 080a 6ac1 1446  .....Z......j..F
        0x0030:  c843 1264                                .C.d
13:55:32.954278 00:09:0f:09:00:24 > 00:50:56:b6:12:47, ethertype IPv4 (0x0800), length 866: (tos 0x0, ttl 61, id 41549, offset 0, flags [none], proto TCP (6), length 852)
    198.51.100.10.22 > 192.0.2.10.59836: Flags [P.], cksum 0xac3b (correct), seq 2001712775:2001713575, ack 1076463188, win 87, options [nop,nop,TS val 3359838821 ecr 1791038534], length 800
        0x0000:  4500 0354 a24d 0000 3d06 d123 0a1e 3c0a  E..T.M..=..#..<.
        0x0010:  c001 010a 0016 e9bc 774f b687 4029 8654  ........wO..@).T
        0x0020:  8018 0057 ac3b 0000 0101 080a c843 1265  ...W.;.......C.e
        0x0030:  6ac1 1446 0000 031c 0514 a49a f195 ca7e  j..F...........~
        0x0040:  a26c 6026 9a44 7ac1 8c89 0000 0059 6469  .l`&.Dz......Ydi
        0x0050:  6666 6965 2d68 656c 6c6d 616e 2d67 726f  ffie-hellman-gro
        0x0060:  7570 2d65 7863 6861 6e67 652d 7368 6131  up-exchange-sha1
        0x0070:  2c64 6966 6669 652d 6865 6c6c 6d61 6e2d  ,diffie-hellman-
        0x0080:  6772 6f75 7031 342d 7368 6131 2c64 6966  group14-sha1,dif
        0x0090:  6669 652d 6865 6c6c 6d61 6e2d 6772 6f75  fie-hellman-grou
        0x00a0:  7031 2d73 6861 3100 0000 0f73 7368 2d72  p1-sha1....ssh-r
        0x00b0:  7361 2c73 7368 2d64 7373 0000 009c 6165  sa,ssh-dss....ae
        0x00c0:  7331 3238 2d63 7472 2c61 6573 3139 322d  s128-ctr,aes192-
        0x00d0:  6374 722c 6165 7332 3536 2d63 7472 6172  ctr,aes256-ctrar
        0x00e0:  6366 6f75 7232 3536 2c61 7263 666f 7572  cfour256,arcfour
        0x00f0:  3132 382c 6165 7331 3238 2d63 6263 2c33  128,aes128-cbc,3
        0x0100:  6465 732d 6362 632c 626c 6f77 6669 7368  des-cbc,blowfish
        0x0110:  2d63 6263 2c63 6173 7431 3238 2d63 6263  -cbc,cast128-cbc
        0x0120:  2c61 6573 3139 322d 6362 632c 6165 7332  ,aes192-cbc,aes2
        0x0130:  3536 2d63 6263 2c61 7263 666f 7572 2c72  56-cbc,arcfour,r
        0x0140:  696a 6e64 6165 6c2d 6362 6340 6c79 7361  ijndael-cbc@lysa
        0x0150:  746f 722e 6c69 752e 7365 0000 009c 6165  tor.liu.se....ae
        0x0160:  7331 3238 2d63 7472 2c61 6573 3139 322d  s128-ctr,aes192-
        0x0170:  6374 722c 6165 7332 3536 2d63 7472 6172  ctr,aes256-ctrar
        0x0180:  6366 6f75 7232 3536 2c61 7263 666f 7572  cfour256,arcfour
        0x0190:  3132 382c 6165 7331 3238 2d63 6263 2c33  128,aes128-cbc,3
        0x01a0:  6465 732d 6362 632c 626c 6f77 6669 7368  des-cbc,blowfish
        0x01b0:  2d63 6263 2c63 6173 7431 3238 2d63 6263  -cbc,cast128-cbc
        0x01c0:  2c61 6573 3139 322d 6362 632c 6165 7332  ,aes192-cbc,aes2
        0x01d0:  3536 2d63 6263 2c61 7263 666f 7572 2c72  56-cbc,arcfour,r
        0x01e0:  696a 6e64 6165 6c2d 6362 6340 6c79 7361  ijndael-cbc@lysa
        0x01f0:  746f 722e 6c69 752e 7365 0000 0093 686d  tor.liu.se....hm
        0x0200:  6163 2d6d 6435 2c68 6d61 632d 7368 6131  ac-md5,hmac-sha1
        0x0210:  2c68 6d61 632d 7269 7065 6d64 3136 302c  ,hmac-ripemd160,
        0x0220:  686d 6163 2d72 6970 656d 6431 3630 406f  hmac-ripemd160@o
        0x0230:  7065 6e73 7368 2e63 6f6d 2c68 6d61 632d  penssh.com,hmac-
        0x0240:  7368 6131 2d39 362c 686d 6163 2d6d 6435  sha1-96,hmac-md5
        0x0250:  2d39 362c 686d 6163 2d73 6861 322d 3235  -96,hmac-sha2-25
        0x0260:  362c 686d 6163 2d73 6861 322d 3235 362d  6,hmac-sha2-256-
        0x0270:  3936 2c68 6d61 632d 7368 6132 2d35 3132  96,hmac-sha2-512
        0x0280:  2c68 6d61 632d 7368 6132 2d35 3132 2d39  ,hmac-sha2-512-9
        0x0290:  3600 0000 9368 6d61 632d 6d64 352c 686d  6....hmac-md5,hm
        0x02a0:  6163 2d73 6861 312c 686d 6163 2d72 6970  ac-sha1,hmac-rip
        0x02b0:  656d 6431 3630 2c68 6d61 632d 7269 7065  emd160,hmac-ripe
        0x02c0:  6d64 3136 3040 6f70 656e 7373 682e 636f  md160@openssh.co
        0x02d0:  6d2c 686d 6163 2d73 6861 312d 3936 2c68  m,hmac-sha1-96,h
        0x02e0:  6d61 632d 6d64 352d 3936 2c68 6d61 632d  mac-md5-96,hmac-
        0x02f0:  7368 6132 2d32 3536 2c68 6d61 632d 7368  sha2-256,hmac-sh
        0x0300:  6132 2d32 3536 2d39 362c 686d 6163 2d73  a2-256-96,hmac-s
        0x0310:  6861 322d 3531 322c 686d 6163 2d73 6861  ha2-512,hmac-sha
        0x0320:  322d 3531 322d 3936 0000 0009 6e6f 6e65  2-512-96....none
        0x0330:  2c7a 6c69 6200 0000 096e 6f6e 652c 7a6c  ,zlib....none,zl
        0x0340:  6962 0000 0000 0000 0000 0000 0000 0000  ib..............
        0x0350:  0000 0000                                ....
13:55:32.954310 00:50:56:b6:12:47 > 00:09:0f:09:00:24, ethertype IPv4 (0x0800), length 66: (tos 0x0, ttl 64, id 35192, offset 0, flags [DF], proto TCP (6), length 52)
    192.0.2.10.59836 > 198.51.100.10.22: Flags [.], cksum 0x075a (incorrect -> 0x33a0), seq 1076463188, ack 2001713575, win 241, options [nop,nop,TS val 1791038535 ecr 3359838821], length 0
        0x0000:  4500 0034 8978 4000 4006 aa18 c001 010a  E..4.x@.@.......
        0x0010:  0a1e 3c0a e9bc 0016 4029 8654 774f b9a7  ..<.....@).TwO..
        0x0020:  8010 00f1 075a 0000 0101 080a 6ac1 1447  .....Z......j..G
        0x0030:  c843 1265                                .C.e
13:55:32.969756 00:50:56:b6:12:47 > 00:09:0f:09:00:24, ethertype IPv4 (0x0800), length 866: (tos 0x0, ttl 64, id 35193, offset 0, flags [DF], proto TCP (6), length 852)
    192.0.2.10.59836 > 198.51.100.10.22: Flags [P.], cksum 0x0a7a (incorrect -> 0x711f), seq 1076463188:1076463988, ack 2001713575, win 241, options [nop,nop,TS val 1791038539 ecr 3359838821], length 800
        0x0000:  4500 0354 8979 4000 4006 a6f7 c001 010a  E..T.y@.@.......
        0x0010:  0a1e 3c0a e9bc 0016 4029 8654 774f b9a7  ..<.....@).TwO..
        0x0020:  8018 00f1 0a7a 0000 0101 080a 6ac1 144b  .....z......j..K
        0x0030:  c843 1265 0000 031c 0414 c1a2 4ad8 43ac  .C.e........J.C.
        0x0040:  be7e 4d8d 95e6 1829 02ab 0000 007e 6469  .~M....).....~di
        0x0050:  6666 6965 2d68 656c 6c6d 616e 2d67 726f  ffie-hellman-gro
        0x0060:  7570 312d 7368 6131 2c64 6966 6669 652d  up1-sha1,diffie-
        0x0070:  6865 6c6c 6d61 6e2d 6772 6f75 7031 342d  hellman-group14-
        0x0080:  7368 6131 2c64 6966 6669 652d 6865 6c6c  sha1,diffie-hell
        0x0090:  6d61 6e2d 6772 6f75 702d 6578 6368 616e  man-group-exchan
        0x00a0:  6765 2d73 6861 312c 6469 6666 6965 2d68  ge-sha1,diffie-h
        0x00b0:  656c 6c6d 616e 2d67 726f 7570 2d65 7863  ellman-group-exc
        0x00c0:  6861 6e67 652d 7368 6132 3536 0000 000f  hange-sha256....
        0x00d0:  7373 682d 7273 612c 7373 682d 6473 7300  ssh-rsa,ssh-dss.
        0x00e0:  0000 e961 7263 666f 7572 3235 362c 6172  ...arcfour256,ar
        0x00f0:  6366 6f75 7231 3238 2c61 6573 3132 382d  cfour128,aes128-
        0x0100:  6374 722c 6165 7331 3932 2d63 7472 2c61  ctr,aes192-ctr,a
        0x0110:  6573 3235 362d 6374 722c 7477 6f66 6973  es256-ctr,twofis
        0x0120:  6831 3238 2d63 7472 2c74 776f 6669 7368  h128-ctr,twofish
        0x0130:  3139 322d 6374 722c 7477 6f66 6973 6832  192-ctr,twofish2
        0x0140:  3536 2d63 7472 2c61 6573 3132 382d 6362  56-ctr,aes128-cb
        0x0150:  632c 6165 7331 3932 2d63 6263 2c61 6573  c,aes192-cbc,aes
        0x0160:  3235 362d 6362 632c 7477 6f66 6973 6831  256-cbc,twofish1
        0x0170:  3238 2d63 6263 2c74 776f 6669 7368 3139  28-cbc,twofish19
        0x0180:  322d 6362 632c 7477 6f66 6973 6832 3536  2-cbc,twofish256
        0x0190:  2d63 6263 2c74 776f 6669 7368 2d63 6263  -cbc,twofish-cbc
        0x01a0:  2c62 6c6f 7766 6973 682d 6374 722c 626c  ,blowfish-ctr,bl
        0x01b0:  6f77 6669 7368 2d63 6263 2c33 6465 732d  owfish-cbc,3des-
        0x01c0:  6374 722c 3364 6573 2d63 6263 0000 00e9  ctr,3des-cbc....
        0x01d0:  6172 6366 6f75 7232 3536 2c61 7263 666f  arcfour256,arcfo
        0x01e0:  7572 3132 382c 6165 7331 3238 2d63 7472  ur128,aes128-ctr
        0x01f0:  2c61 6573 3139 322d 6374 722c 6165 7332  ,aes192-ctr,aes2
        0x0200:  3536 2d63 7472 2c74 776f 6669 7368 3132  56-ctr,twofish12
        0x0210:  382d 6374 722c 7477 6f66 6973 6831 3932  8-ctr,twofish192
        0x0220:  2d63 7472 2c74 776f 6669 7368 3235 362d  -ctr,twofish256-
        0x0230:  6374 722c 6165 7331 3238 2d63 6263 2c61  ctr,aes128-cbc,a
        0x0240:  6573 3139 322d 6362 632c 6165 7332 3536  es192-cbc,aes256
        0x0250:  2d63 6263 2c74 776f 6669 7368 3132 382d  -cbc,twofish128-
        0x0260:  6362 632c 7477 6f66 6973 6831 3932 2d63  cbc,twofish192-c
        0x0270:  6263 2c74 776f 6669 7368 3235 362d 6362  bc,twofish256-cb
        0x0280:  632c 7477 6f66 6973 682d 6362 632c 626c  c,twofish-cbc,bl
        0x0290:  6f77 6669 7368 2d63 7472 2c62 6c6f 7766  owfish-ctr,blowf
        0x02a0:  6973 682d 6362 632c 3364 6573 2d63 7472  ish-cbc,3des-ctr
        0x02b0:  2c33 6465 732d 6362 6300 0000 3968 6d61  ,3des-cbc...9hma
        0x02c0:  632d 7368 6132 2d32 3536 2c68 6d61 632d  c-sha2-256,hmac-
        0x02d0:  7368 6131 2d39 362c 686d 6163 2d73 6861  sha1-96,hmac-sha
        0x02e0:  312c 686d 6163 2d6d 6435 2d39 362c 686d  1,hmac-md5-96,hm
        0x02f0:  6163 2d6d 6435 0000 0039 686d 6163 2d73  ac-md5...9hmac-s
        0x0300:  6861 322d 3235 362c 686d 6163 2d73 6861  ha2-256,hmac-sha
        0x0310:  312d 3936 2c68 6d61 632d 7368 6131 2c68  1-96,hmac-sha1,h
        0x0320:  6d61 632d 6d64 352d 3936 2c68 6d61 632d  mac-md5-96,hmac-
        0x0330:  6d64 3500 0000 046e 6f6e 6500 0000 046e  md5....none....n
        0x0340:  6f6e 6500 0000 0000 0000 0000 0000 0000  one.............
        0x0350:  49a5 4e70                                I.Np
````

From `isValidEngine()` in `Base.php` I'm expecting `$this->cipher_name_openssl` to be set to `rc4-40` in my case, the `openssl` extension is loaded (as seen in the packet capture), and my PHP version is:

```
~# php -v
PHP 7.1.13-1+0~20180105151623.14+stretch~1.gbp1086fa (cli) (built: Jan  5 2018 15:16:25) ( NTS )
Copyright (c) 1997-2017 The PHP Group
Zend Engine v3.1.0, Copyright (c) 1998-2017 Zend Technologies
    with Zend OPcache v7.1.13-1+0~20180105151623.14+stretch~1.gbp1086fa, Copyright (c) 1999-2017, by Zend Technologies
    with Xdebug v2.6.0, Copyright (c) 2002-2018, by Derick Rethans
```

I expect `$this->cipher_name_openssl` to be `rc4-40` and `openssl_get_cipher_methods()` returns:

```
~# php -r 'var_dump(openssl_get_cipher_methods());'
Command line code:1:
array(193) {
  [0] =>
  string(11) "AES-128-CBC"
  [1] =>
  string(11) "AES-128-CFB"
  [2] =>
  string(12) "AES-128-CFB1"
  [3] =>
  string(12) "AES-128-CFB8"
  [4] =>
  string(11) "AES-128-CTR"
  [5] =>
  string(11) "AES-128-ECB"
  [6] =>
  string(11) "AES-128-OCB"
  [7] =>
  string(11) "AES-128-OFB"
  [8] =>
  string(11) "AES-128-XTS"
  [9] =>
  string(11) "AES-192-CBC"
  [10] =>
  string(11) "AES-192-CFB"
  [11] =>
  string(12) "AES-192-CFB1"
  [12] =>
  string(12) "AES-192-CFB8"
  [13] =>
  string(11) "AES-192-CTR"
  [14] =>
  string(11) "AES-192-ECB"
  [15] =>
  string(11) "AES-192-OCB"
  [16] =>
  string(11) "AES-192-OFB"
  [17] =>
  string(11) "AES-256-CBC"
  [18] =>
  string(11) "AES-256-CFB"
  [19] =>
  string(12) "AES-256-CFB1"
  [20] =>
  string(12) "AES-256-CFB8"
  [21] =>
  string(11) "AES-256-CTR"
  [22] =>
  string(11) "AES-256-ECB"
  [23] =>
  string(11) "AES-256-OCB"
  [24] =>
  string(11) "AES-256-OFB"
  [25] =>
  string(11) "AES-256-XTS"
  [26] =>
  string(6) "BF-CBC"
  [27] =>
  string(6) "BF-CFB"
  [28] =>
  string(6) "BF-ECB"
  [29] =>
  string(6) "BF-OFB"
  [30] =>
  string(16) "CAMELLIA-128-CBC"
  [31] =>
  string(16) "CAMELLIA-128-CFB"
  [32] =>
  string(17) "CAMELLIA-128-CFB1"
  [33] =>
  string(17) "CAMELLIA-128-CFB8"
  [34] =>
  string(16) "CAMELLIA-128-CTR"
  [35] =>
  string(16) "CAMELLIA-128-ECB"
  [36] =>
  string(16) "CAMELLIA-128-OFB"
  [37] =>
  string(16) "CAMELLIA-192-CBC"
  [38] =>
  string(16) "CAMELLIA-192-CFB"
  [39] =>
  string(17) "CAMELLIA-192-CFB1"
  [40] =>
  string(17) "CAMELLIA-192-CFB8"
  [41] =>
  string(16) "CAMELLIA-192-CTR"
  [42] =>
  string(16) "CAMELLIA-192-ECB"
  [43] =>
  string(16) "CAMELLIA-192-OFB"
  [44] =>
  string(16) "CAMELLIA-256-CBC"
  [45] =>
  string(16) "CAMELLIA-256-CFB"
  [46] =>
  string(17) "CAMELLIA-256-CFB1"
  [47] =>
  string(17) "CAMELLIA-256-CFB8"
  [48] =>
  string(16) "CAMELLIA-256-CTR"
  [49] =>
  string(16) "CAMELLIA-256-ECB"
  [50] =>
  string(16) "CAMELLIA-256-OFB"
  [51] =>
  string(9) "CAST5-CBC"
  [52] =>
  string(9) "CAST5-CFB"
  [53] =>
  string(9) "CAST5-ECB"
  [54] =>
  string(9) "CAST5-OFB"
  [55] =>
  string(8) "ChaCha20"
  [56] =>
  string(17) "ChaCha20-Poly1305"
  [57] =>
  string(7) "DES-CBC"
  [58] =>
  string(7) "DES-CFB"
  [59] =>
  string(8) "DES-CFB1"
  [60] =>
  string(8) "DES-CFB8"
  [61] =>
  string(7) "DES-ECB"
  [62] =>
  string(7) "DES-EDE"
  [63] =>
  string(11) "DES-EDE-CBC"
  [64] =>
  string(11) "DES-EDE-CFB"
  [65] =>
  string(11) "DES-EDE-OFB"
  [66] =>
  string(8) "DES-EDE3"
  [67] =>
  string(12) "DES-EDE3-CBC"
  [68] =>
  string(12) "DES-EDE3-CFB"
  [69] =>
  string(13) "DES-EDE3-CFB1"
  [70] =>
  string(13) "DES-EDE3-CFB8"
  [71] =>
  string(12) "DES-EDE3-OFB"
  [72] =>
  string(7) "DES-OFB"
  [73] =>
  string(8) "DESX-CBC"
  [74] =>
  string(10) "RC2-40-CBC"
  [75] =>
  string(10) "RC2-64-CBC"
  [76] =>
  string(7) "RC2-CBC"
  [77] =>
  string(7) "RC2-CFB"
  [78] =>
  string(7) "RC2-ECB"
  [79] =>
  string(7) "RC2-OFB"
  [80] =>
  string(3) "RC4"
  [81] =>
  string(6) "RC4-40"
  [82] =>
  string(12) "RC4-HMAC-MD5"
  [83] =>
  string(8) "SEED-CBC"
  [84] =>
  string(8) "SEED-CFB"
  [85] =>
  string(8) "SEED-ECB"
  [86] =>
  string(8) "SEED-OFB"
  [87] =>
  string(11) "aes-128-cbc"
  [88] =>
  string(11) "aes-128-ccm"
  [89] =>
  string(11) "aes-128-cfb"
  [90] =>
  string(12) "aes-128-cfb1"
  [91] =>
  string(12) "aes-128-cfb8"
  [92] =>
  string(11) "aes-128-ctr"
  [93] =>
  string(11) "aes-128-ecb"
  [94] =>
  string(11) "aes-128-gcm"
  [95] =>
  string(11) "aes-128-ocb"
  [96] =>
  string(11) "aes-128-ofb"
  [97] =>
  string(11) "aes-128-xts"
  [98] =>
  string(11) "aes-192-cbc"
  [99] =>
  string(11) "aes-192-ccm"
  [100] =>
  string(11) "aes-192-cfb"
  [101] =>
  string(12) "aes-192-cfb1"
  [102] =>
  string(12) "aes-192-cfb8"
  [103] =>
  string(11) "aes-192-ctr"
  [104] =>
  string(11) "aes-192-ecb"
  [105] =>
  string(11) "aes-192-gcm"
  [106] =>
  string(11) "aes-192-ocb"
  [107] =>
  string(11) "aes-192-ofb"
  [108] =>
  string(11) "aes-256-cbc"
  [109] =>
  string(11) "aes-256-ccm"
  [110] =>
  string(11) "aes-256-cfb"
  [111] =>
  string(12) "aes-256-cfb1"
  [112] =>
  string(12) "aes-256-cfb8"
  [113] =>
  string(11) "aes-256-ctr"
  [114] =>
  string(11) "aes-256-ecb"
  [115] =>
  string(11) "aes-256-gcm"
  [116] =>
  string(11) "aes-256-ocb"
  [117] =>
  string(11) "aes-256-ofb"
  [118] =>
  string(11) "aes-256-xts"
  [119] =>
  string(6) "bf-cbc"
  [120] =>
  string(6) "bf-cfb"
  [121] =>
  string(6) "bf-ecb"
  [122] =>
  string(6) "bf-ofb"
  [123] =>
  string(16) "camellia-128-cbc"
  [124] =>
  string(16) "camellia-128-cfb"
  [125] =>
  string(17) "camellia-128-cfb1"
  [126] =>
  string(17) "camellia-128-cfb8"
  [127] =>
  string(16) "camellia-128-ctr"

  (more elements)...
}
```

I expected it to elect `arcfour128` which in `_encryption_algorithm_to_crypt_instance($algorithm)` returns an `RC4` instance.

I'm probably doing something dumb so could anyone give me a hand? :smile: 

Thanks!

**Comment by cgkkevinr** [comment]
Thanks, that's perfectly clear!
